Category,Data Series Title,Data Source,Publically Available (Y/N),Timeliness (Covers),Delay (approx. days),pub_lag,pub_lag_true,Release ,Revision,Description ,DataTransCode,Data Units,Info Link,Data Download,VariableName_in_File
Manufacturing,Manufacturers shipments: Duarable goods,US Census Bereau,Y,Monthly (Past Month) ,m+31,31,62,End Month,"Advance Report Current month, followed by Full report following month","The Manufacturers’ Shipments, Inventories, and Orders (M3) survey provides broad-based, monthly statistical data on economic conditions in the domestic manufacturing sector. The survey measures current industrial activity and provides an indication of future business trends.",MonMC_perc,Month on Month Change (Percent) ,"US Census Bureau Manufacturers’ Shipments, Inventories, and Orders",https://fred.stlouisfed.org/graph/fredgraph.csv?bgcolor=%23e1e9f0&chart_type=line&drp=0&fo=open%20sans&graph_bgcolor=%23ffffff&height=450&mode=fred&recession_bars=on&txtcolor=%23444444&ts=12&tts=12&width=1168&nt=0&thu=0&trc=0&show_legend=yes&show_axis_titles=yes&show_tooltip=yes&id=AMDMVS&scale=left&cosd=1992-01-01&coed=2022-01-01&line_color=%234572a7&link_values=false&line_style=solid&mark_type=none&mw=3&lw=2&ost=-99999&oet=99999&mma=0&fml=a&fq=Monthly&fam=avg&fgst=lin&fgsnd=2020-02-01&line_index=1&transformation=lin&vintage_date=2022-03-22&revision_date=2022-03-22&nd=1992-01-01,AMDMVS
Manufacturing,Mfrs. Unfilled orders: All manufacturing industries,US Census Bereau,Y,Monthly (Past Month) ,m+31,31,62,End Month,"Advance Report Current month, followed by Full report following month","The Manufacturers’ Shipments, Inventories, and Orders (M3) survey provides broad-based, monthly statistical data on economic conditions in the domestic manufacturing sector. The survey measures current industrial activity and provides an indication of future business trends.",MonMC_perc,Month on Month Change (Percent) ,"US Census Bureau Manufacturers’ Shipments, Inventories, and Orders",https://fred.stlouisfed.org/graph/fredgraph.csv?bgcolor=%23e1e9f0&chart_type=line&drp=0&fo=open%20sans&graph_bgcolor=%23ffffff&height=450&mode=fred&recession_bars=on&txtcolor=%23444444&ts=12&tts=12&width=1168&nt=0&thu=0&trc=0&show_legend=yes&show_axis_titles=yes&show_tooltip=yes&id=AMTMUO&scale=left&cosd=1992-01-01&coed=2022-01-01&line_color=%234572a7&link_values=false&line_style=solid&mark_type=none&mw=3&lw=2&ost=-99999&oet=99999&mma=0&fml=a&fq=Monthly%2C%20End%20of%20Period&fam=avg&fgst=lin&fgsnd=2020-02-01&line_index=1&transformation=lin&vintage_date=2022-03-22&revision_date=2022-03-22&nd=1992-01-01,AMTMUO
Manufacturing,Manufacturers inventories: Durable goods,US Census Bereau,Y,Monthly (Past Month) ,m+31,31,62,End Month,Advance release given,,MonMC_perc,Month on Month Change (Percent) ,"US Census Bureau Manufacturers’ Shipments, Inventories, and Orders",https://fred.stlouisfed.org/graph/fredgraph.csv?bgcolor=%23e1e9f0&chart_type=line&drp=0&fo=open%20sans&graph_bgcolor=%23ffffff&height=450&mode=fred&recession_bars=on&txtcolor=%23444444&ts=12&tts=12&width=1168&nt=0&thu=0&trc=0&show_legend=yes&show_axis_titles=yes&show_tooltip=yes&id=AMDMTI&scale=left&cosd=1992-01-01&coed=2022-01-01&line_color=%234572a7&link_values=false&line_style=solid&mark_type=none&mw=3&lw=2&ost=-99999&oet=99999&mma=0&fml=a&fq=Monthly%2C%20End%20of%20Period&fam=avg&fgst=lin&fgsnd=2020-02-01&line_index=1&transformation=lin&vintage_date=2022-03-22&revision_date=2022-03-22&nd=1992-01-01,AMDMTI
Other,Real gross domestic income,US Bureau of Economic Analysis,Y,Monthly (2 Quarters Ago),t+120,120,120,Last Business day of Month ,"Advanced, second and third estimates within quarter. ",,QonQC_annual,Quarter on Quarter Change (annual rate),Gross Domestic Product | U.S. Bureau of Economic Analysis (BEA),https://fred.stlouisfed.org/graph/fredgraph.csv?bgcolor=%23e1e9f0&chart_type=line&drp=0&fo=open%20sans&graph_bgcolor=%23ffffff&height=450&mode=fred&recession_bars=on&txtcolor=%23444444&ts=12&tts=12&width=1168&nt=0&thu=0&trc=0&show_legend=yes&show_axis_titles=yes&show_tooltip=yes&id=A261RX1Q020SBEA&scale=left&cosd=1947-01-01&coed=2021-07-01&line_color=%234572a7&link_values=false&line_style=solid&mark_type=none&mw=3&lw=2&ost=-99999&oet=99999&mma=0&fml=a&fq=Quarterly&fam=avg&fgst=lin&fgsnd=2020-02-01&line_index=1&transformation=lin&vintage_date=2022-03-22&revision_date=2022-03-22&nd=1947-01-01,A261RX1Q020SBEA
Income,Real disposable personal income ,US Bureau of Economic Analysis,Y,Monthly (Past Month) ,t+31,31,62,Last Business day of Month ,None,,MonMC_perc,Month on Month Change (Percent) ,Personal Income | U.S. Bureau of Economic Analysis (BEA),https://fred.stlouisfed.org/graph/fredgraph.csv?bgcolor=%23e1e9f0&chart_type=line&drp=0&fo=open%20sans&graph_bgcolor=%23ffffff&height=450&mode=fred&recession_bars=on&txtcolor=%23444444&ts=12&tts=12&width=1168&nt=0&thu=0&trc=0&show_legend=yes&show_axis_titles=yes&show_tooltip=yes&id=DSPIC96&scale=left&cosd=1959-01-01&coed=2022-01-01&line_color=%234572a7&link_values=false&line_style=solid&mark_type=none&mw=3&lw=2&ost=-99999&oet=99999&mma=0&fml=a&fq=Monthly&fam=avg&fgst=lin&fgsnd=2020-02-01&line_index=1&transformation=lin&vintage_date=2022-03-22&revision_date=2022-03-22&nd=1959-01-01,DSPIC96
International Trade,Exports: Goods and services,US Census Bereau,Y,Monthly (2 Months Ago),m+35,35,66,Begin Month,None,,MonMC_perc,Month on Month Change (Percent) ,U.S. International Trade in Goods and Services (FT900) (census.gov),https://fred.stlouisfed.org/graph/fredgraph.csv?bgcolor=%23e1e9f0&chart_type=line&drp=0&fo=open%20sans&graph_bgcolor=%23ffffff&height=450&mode=fred&recession_bars=on&txtcolor=%23444444&ts=12&tts=12&width=1168&nt=0&thu=0&trc=0&show_legend=yes&show_axis_titles=yes&show_tooltip=yes&id=BOPTEXP&scale=left&cosd=1992-01-01&coed=2022-01-01&line_color=%234572a7&link_values=false&line_style=solid&mark_type=none&mw=3&lw=2&ost=-99999&oet=99999&mma=0&fml=a&fq=Monthly&fam=avg&fgst=lin&fgsnd=2020-02-01&line_index=1&transformation=lin&vintage_date=2022-03-22&revision_date=2022-03-22&nd=1992-01-01,BOPTEXP
International Trade,Imports: Goods and services,US Census Bereau,Y,Monthly (2 Months ago),m+35,35,66,Begin Month,None,,MonMC_perc,Month on Month Change (Percent) ,U.S. International Trade in Goods and Services (FT900) (census.gov),https://fred.stlouisfed.org/graph/fredgraph.csv?bgcolor=%23e1e9f0&chart_type=line&drp=0&fo=open%20sans&graph_bgcolor=%23ffffff&height=450&mode=fred&recession_bars=on&txtcolor=%23444444&ts=12&tts=12&width=1168&nt=0&thu=0&trc=0&show_legend=yes&show_axis_titles=yes&show_tooltip=yes&id=BOPTIMP&scale=left&cosd=1992-01-01&coed=2022-01-01&line_color=%234572a7&link_values=false&line_style=solid&mark_type=none&mw=3&lw=2&ost=-99999&oet=99999&mma=0&fml=a&fq=Monthly&fam=avg&fgst=lin&fgsnd=2020-02-01&line_index=1&transformation=lin&vintage_date=2022-03-22&revision_date=2022-03-22&nd=1992-01-01,BOPTIMP
Surveys,University of Michigan: Consumer Sentiment,US Census Bereau,Y,Monthly (Past Month) ,t+24,24,55,Mid Month,None,,Index,Index,Surveys of Consumers (University of Michigan),https://fred.stlouisfed.org/graph/fredgraph.csv?bgcolor=%23e1e9f0&chart_type=line&drp=0&fo=open%20sans&graph_bgcolor=%23ffffff&height=450&mode=fred&recession_bars=on&txtcolor=%23444444&ts=12&tts=12&width=1168&nt=0&thu=0&trc=0&show_legend=yes&show_axis_titles=yes&show_tooltip=yes&id=UMCSENT&scale=left&cosd=1952-11-01&coed=2022-05-01&line_color=%234572a7&link_values=false&line_style=solid&mark_type=none&mw=3&lw=2&ost=-99999&oet=99999&mma=0&fml=a&fq=Monthly&fam=avg&fgst=lin&fgsnd=2020-02-01&line_index=1&transformation=lin&vintage_date=2022-07-25&revision_date=2022-07-25&nd=1952-11-01,UMCSENT
